name,ring,quadrant,isNew,description,Laatst bijgewerkt,,
Privacy Enhancing Technologies,Explore,Techniques,FALSE,"Dit is een verzamelnaam voor technieken die gebruikt kunnen worden om data te beschermen. Het doel is om de privacy zoveel mogelijk te waarborgen zonder de functionaliteit van systemen te verliezen. Voorbeelden van privacy enhancing technologies zijn Multi-Party Computation, Federated learning, Differential Privacy maar ook data anonimisering en pseudonimisering. Het ETC is momenteel vooral de mogelijkheden van MPC aan het onderzoeken en doet met o.a. KvK & TNO mee aan een MPC pilot.",06-09-21,,
Robot Process Automation (RPA),Assess,Techniques,FALSE,Processen met repeterende stappen kunnen in steeds grotere maten gerobotiseerd en daarmee geautomatiseerd worden. Binnen het Kadaster heeft er een geslaagde pilot plaatsgevonden rond het in kaart brengen van de ov-kosten. Momenteel wordt onderzocht welke processen zich nog meer lenen voor deze technologie. Daarbij moeten we de opmerking maken dat RPA vooral van toepassing is voor processen die niet echt (snel) aangepast en (dus) verbeterd kunnen worden. Bij Kadaster wordt al veel continuous delivery en actief ingezet op het up-to-date houden van onze applicatie en landschap en daarmee is RPA minder relevant of van toegevoegde waarde.,06-09-21,,
Smart Anything,Monitor,Data management & Infrastructure,FALSE,"Smart betekent slim, autonoom, rijk in de beleving en daarmee wordt gedoeld op slimme apparaten die autonoom kunnen opereren, veel sensoren, veel data, begrijpelijke en rijke visualisaties. En dit concept wordt op steeds meer zaken toegepast: Smart City, Smart Home, Smart Workspace, Smart Dust, Smart Materials. Smart Anything dus :-) Dit is een breed gebied waarin concepten en technologie overeenkomstig is of juist heel erg verschillend. Sensoren, IoT en Empowered Edge vormen hier onderdelen in en het wordt ‘Smart’ als deze worden gecombineerd met cloud oplossingen en visualisaties waarin data tot betekenisvolle informatie wordt vertaald en begrijpelijk en toegankelijk wordt gemaakt voor de mens. Diverse onderdelen van Smart Anything staan apart in deze TechRadar (zie bv. smart city) en zijn wisselend relevant voor het Kadaster. De toepassing van Smart bepaald in hoeverre dat relevant is voor het Kadaster. Smart Home en Smart City zijn relevant vanuit het perspectief van waarde van huizen en gebiedsontwikkeling en geografische informatie. Smart Workspace is vooral relevant voor het Kadaster voor haar eigen medewerkers. Smart Dust, hele kleine sensoren, mogelijk zijn microscopisch klein, zijn niet relevant, net zoals Smart Materials. Smart Anything is een relevante trend en het Kadaster zou moeten onderzoeken waar het kan bijdragen en participeren en tegelijk zijn zij slechts een schakel in de hele Smart Anything 'beweging'.",06-09-21,,
Smart City,Assess,Data management & Infrastructure,FALSE,"Smart Cities zijn onderdeel van Smart Anything maar wilden we graag los benoemen. Smart Cities zijn op dit moment namelijk het meest relevant voor het Kadaster. Het Kadaster zal zelf geen Smart Cities gaan ontwikkelen maar kan een aandeel hebben in het leveren van de data en kan participeren in de ontwikkeling van een Smart City. Het Kadaster heeft  laatst samen met 50 andere partijen de ""City Deal; een slimme stad zo doe je dat"" ondertekend.",06-09-21,,
Virtual Assistant,Assess,Tools,FALSE,"Virtual Assistants - of Conversational User Interfaces - zien we tegenwoordig steeds meer om ons heen, denk aan Apple Siri, Google Assistent of de chatbots van vele bedrijven. Bij conversational user interfaces gaat het om het voeren van een gesprek via chatbots of voice assistants. Chatbots bestaan al lang, maar nog niet zo lang met extra hulp van Artificial Intelligence en kant en klaar getrainde (taal)modellen. Daarmee is het mogelijk om een chatbot veel persoonlijker en minder strikt een vooraf bedacht schema te laten volgen. Voice assistance gaat technisch gezien nog een stap verder en hierbij wordt nog meer gebruik gemaakt van Artificial Intelligence. Chatbots zullen dan waarschijnlijk ook eerder worden ingezet binnen het Kadaster. Het Kadaster kan zeker voordeel hebben van chatbots en het is goed om te onderzoeken waar chatbots de werkdruk kunnen verlichten en/of de eerste lijn van vragen kunnen beantwoorden. Het Kadaster experimenteert momenteel zelf met een chatbot genaamd LOKI. Loki is een experiment waarbij we de toegevoegde waarde willen aantonen van een chatbot voor Locatie-gebaseerde Kadaster Informatieverstrekking.",06-09-21,,
Self-sovereign identity,Monitor,Data management & Infrastructure,FALSE,Self Sovereign Identity (SSI) is een technologie voor online identificatie. Zelf soeverein in dezen betekent niet afhankelijk van een uitgevende instantie. Het meest bekend is SSI voor personen. Hierbij kan een individu verschillende 'claims' maken over zijn of haar identiteit. Door middel van het valideren van claims kan iemand's online identeit worden opgebouwd. SSI voor personen wordt het meest onderzocht (zowel technisch als politiek) en als Kadaster zijnde doen wij er goed aan deze ontwikkeling te volgen. Naast personen kan SSI ook worden toegepast op objecten en devices. SSI voor gebouwen heeft een directer raakvlak met het Kadaster. Zo kan Kadaster een validerende rol spelen (de claim bevestigen dat persoon x inderdaad eigenaar is van pand y). Ook onderzoekt Kadaster hoe SSI voor een gebouw er uit kan zien in de vorm van een Unique Object Identifier als systematiek om gebouwen te identifceren. Wanneer het concept van SSI en claims wordt gecombineerd met toegangsmanagement krijgt de gebruiker meer controle over welke (persoons)gegevens worden gedeeld.,06-09-21,,
Orbital Aerospace,Monitor,Data management & Infrastructure,FALSE,"We zien dat het steeds goedkoper wordt om satellieten de lucht in te brengen en daardoor komen er ook steeds meer bij. Het gaat met name om een toename in Low Earth Orbit (LEO) satellieten. Voor het Kadaster zien we 3 mogelijk relevante doeleinden van satellieten; gps, low latency internet en remote sensing. Deze kunnen verder onderzocht worden.  ",06-09-21,,
Machine learning,Adopt,Techniques,TRUE,"Machine learning (ML) is een subset van AI. ML modellen onderscheiden zich van andere AI soorten doordat ze in staat zijn om zelfstandig te leren problemen oplossen. De algoritmes die zo’n model mogelijk maken zijn vaak erg wiskundig en statistisch onderbouwd. ML modellen zijn zelf ook weer op te delen in verschillende categorieën. Vaak wordt dit gedaan in de manier waarop ze getraind worden: supervised, semi-supervised, unsupervised, transfer- en reinforcement learning.
Binnen het Kadaster zetten we ML oa in bij Akte-AI en voor het herkennen van nieuwbouw of zelfbouw in aktes. Eind 2018 is Akte-AI gestart om augmentatie van kennis van de akte toe te voegen aan de aktes die het Kadaster in PDF bezit. Augmentatie omdat er combinaties zijn van AI modellen en reguliere software. De resultaten van het systeem worden intensief gevalideerd – en gecorrigeerd – door handmatige controles.
In vergelijking met deep learning modellen zijn machine learning modellen goedkoper, sneller en beter uitlegbaar maar ook minder krachtig en robuust. Het is belangrijk om per use case een goede afweging te maken tussen de verschillende modellen.",06-09-21,,
Deep learning,Adopt,Techniques,TRUE,"Deep learning (DL) modellen zijn een subset van ML modellen. Deze modellen zijn gebaseerd op neurale netwerken. DL modellen zijn krachtiger dan ML modellen omdat ze zelf leren hoe ze de data moeten interpreteren en welke interpretaties van de data er nu het belangrijkst zijn bij het maken van een beslissing. Het trainen van DL modellen vergt veel rekenkracht, geheugen en data. Per use case is het belangrijk om te bedenken of een DL model nodig is of dat een ML model bijv. voldoende is. 
Binnen het Kadaster worden DL modellen met name ingezet voor beeldherkenning. Bij het ontwikkeling van Kadastrale Kaart Next wordt AI ingezet voor het interpreteren van handschrift en tekeningen. Om de kwaliteit hiervan te controleren vind een intensief handmatig proces plaats. Daaruit blijkt dat de resultaten zeer goed zijn.  Dit proces is in overgangsfase  van de status ‘in ontwikkeling’ naar ‘productie’. Daarnaast lopen nog diverse andere onderzoeken waarbij DL wordt ingezet. Voorbeelden hiervan zijn het detecteren van zonnepanelen en BRT-objecten op luchtfoto’s.",06-09-21,,
